{
    "client_id": "kasasagi",
    "receipt_id": "RCV-2026-00931",
    "invoice_obligation_id": "01K6A2M4P6R8T0V2X4Z6B8D0F2",
    "prepayment_obligation_id": "01K63Z9W3V8Q7X1M5N2B4C6D8E",
    "supplier_id": "1042",
    "received_at": "2026-10-22T11:30:00Z",
    "lines": [
        {
            "item_number": "REOL-38",
            "quantity": "1",
            "amount_dkk": "6860.00",
            "stock_category": "dk"
        },
        {
            "item_number": "SKAENK-30",
            "quantity": "1",
            "amount_dkk": "2170.00",
            "stock_category": "dk"
        }
    ]
}
